{
  "$schema": "https://json-schema.org/draft/2020-12/schema",
  "$id": "https://spherical-mammoth.local/contracts/delivery/email-sink-mammoth-event.v1.schema.json",
  "title": "Email Sink Accepted Mammoth Event v1",
  "description": "The subset of Mammoth v1.5.1 row-level webhook events accepted by the Spherical Mammoth email sink.",
  "type": "object",
  "additionalProperties": true,
  "required": [
    "event_id",
    "source",
    "operation",
    "namespace",
    "entity",
    "occurred_at",
    "data",
    "changes",
    "metadata"
  ],
  "properties": {
    "event_id": { "type": "string", "minLength": 1 },
    "source": { "type": "string", "minLength": 1 },
    "operation": { "enum": ["insert", "update", "delete"] },
    "namespace": { "type": "string", "minLength": 1 },
    "entity": { "type": "string", "minLength": 1 },
    "identity": { "type": ["object", "null"] },
    "source_position": { "type": ["string", "integer", "null"] },
    "transaction_id": { "type": ["string", "integer", "null"] },
    "occurred_at": { "type": "string", "format": "date-time" },
    "data": { "type": "object" },
    "changes": { "type": "array" },
    "metadata": { "type": "object" }
  }
}
